{
    "$schema": "http://json-schema.org/draft-07/schema",
    "$id": "http://example.com/zoo.schema.json",
    "title": "Zoo",
    "description": "Objekt naší zoo",
    "type": "object",
    "properties": {
        "Pavilony": {
            "type": "array",
            "items": [],
            "additionalItems": {
                "$ref": "http://example.com/pavilon.schema.json"
            }
        },
        "TypyZvířat": {
            "type": "array",
            "items": [],
            "additionalItems": {
                "$ref": "http://example.com/typZvirat.schema.json"
            }
        },
        "TypyStrav": {
            "type": "array",
            "items": [],
            "additionalItems": {
                "$ref": "http://example.com/typStravy.schema.json"
            }
        },
        "Zaměstnanci": {
            "type": "object",
            "allOf": [
                {
                    "$ref": "http://example.com/zamestnanci.schema.json"
                }   
            ]
        },
        "Výběhy": {
            "type": "array",
            "items": [],
            "additionalItems": {
                "$ref": "http://example.com/vybehy.schema.json"
            }
        }
    },
    "additionalProperties": false, 
    "required": [ "Pavilony", "TypyZvířat", "TypyStrav", "Zaměstnanci", "Výběhy"]
}
